{
    "campus": {
        "id": 1,
        "descricao": "NOME COMPLETO DO CAMPUS",
        "sigla": "NCC"
    },
    "curso": {
        "id": 1,
        "codigo": "00001",
        "nome": "Tecnologia em Redes de Computadores",
        "descricao": "Tecnologia em Redes de Computadores - Nome Completo do Campus"
    },
    "turma": {
        "id": 1,
        "codigo": "20221.6.00001.1E"
    },
    "diario": {
        "id": 1,
        "situacao": "Aberto",
        "descricao": "Bancos de Dados",
        "descricao_historico": "Bancos de Dados",
        "sigla": "TEC.0001"
    },
    "professores": [
        {
            "id": 1,
            "login": "1234567",
            "nome": "Nome completo de um professor principal",
            "email": "nome.sobrenome@ifrn.edu.br",
            "email_secundario": "nome.sobrenome@gmail.com",
            "status": "ativo",
            "tipo": "Principal"
        }
    ],
    "alunos": [
        {
            "id": 1,
            "matricula": "20183000010001",
            "nome": "Nome completo do aluno",
            "email": "nome.compelto@academico.ifrn.edu.br",
            "email_secundario": "nome.completo@hotmail.com",
            "situacao": "ativo",
            "polo": null
        }
    ],
    "polo": null,
    "componente": {
        "id": 1,
        "sigla": "TEC.0001",
        "descricao": "Bancos de Dados",
        "descricao_historico": "Bancos de Dados",
        "periodo": null,
        "tipo": 1,
        "optativo": false,
        "qtd_avaliacoes": 2
    }
}